Comment (English),Comment (Chinese),Compound_Score,Original Data,Translation Status
"First of all, if you are a player who watched to buy, then my suggestion is: Don't buy it, at least this is the case at this stage.
If you are a war hammer fan, I will recommend you to buy as appropriate, but if you are not a fans of war hammers at all, then repeat the first sentence.

In this game, I mainly play Jianwei (completely unlocked). In this version of this version, it is basically one of the clown, and I can only play as auxiliary.My evaluation is only based on the play experience of Jianwei.

So why don't I recommend buying?

In the beginning of the version, Jian Wei was undoubtedly a lot of sky, fighting back on brainless bombs, and it was really cool to provide teammates with blood recovery and resurrection services.
If the production team does not want to balance it, then I will recommend you to buy it.

First, the player's mobility is too bad.
Big Brother, this is Astart, not Ogrin, who is wearing heavy armor, you are running faster than the mortal in the game. Is this appropriate?The dark tide superman next door runs faster than your so -called Old E God.No matter which version, this is a problem that I have been talking about. Many big maps, you are not running fast, the only use is to use it on the way to run.Hongru, the bullet is full.

The second point is also the most important point. The production team is mentally retarded, especially in terms of balance.

Someone may spray, oh, it is obvious that you are too simple at first, and it is difficult to come.
He ordered the church, we want the strong to the strong, that is, three powerful Astarts to play the same strong sea of ​​battles, not you cut everyone into old, weak, sick and disabledCut with bugs.

There are too many places to change the disgusting people in terms of balance, here is one by one.

First, most of the actions of Jianwei can be canceled afterwards. Now it is gone. When you are doing thousands of children, you have to be careful to make a move. He is afraid that people can do not dry you directly for a red circle.

Second, the dodge of invincible frames shorten and the judgment of the attack is shortened. What do you change this B gadget? I ask?Do you think the player is so comfortable, right?Have you ever experienced the current game?Do you use one -third of your Orgarin's IQ to think about it, is this too supermodel?Yes, very supermodel, where is the supermodel?Because except for fighting back, all of them are waste!You can only flash against the unstoppable red circle!You can definitely flash one -on -one, what about the sea?You roll off the invincible frames, as long as you want to eat damage as soon as you roll, then I will also play a cow.

Third, when I talk about this back, I am angry. Do you know why everyone has no brain counterattack?It's because the melee damage you designed is really true!Very tm low!I cut 3 sets that it is better to play a high damage once, isn't it a buddy, are you gangsters who are gangsters to force and fear and abuse?Have you considered why players have formed these play?You can lay down to sleep at this cut. If you accidentally find you to find your teeth.

Fourth, you say a balanced, and the surface is adjusted. In fact, your bright and secret reforms are not known.The first three problems seem to be within your expectations, right?If you want to repeat the super earth, just say.
Take remote, my sword guard is really afraid of remote, especially when fighting, you can't hold the shield all the time?Do you can't stop the gun behind, right?You said that you have reduced the hit rate of bullets during melee, and what is the result?When I approached the enemy to play close -up war, your B monsters are unwilling to melee, just to shoot a gun with a face with a face, your TM orange predecessor is ""as long as this distance, you can’t escape it!"" YesThe hit rate is reduced. The hit rate on TM's face is not low. My TM full blood sword sword guard N5 was evaporated by a bug directly.Dao Lie Fire, what do you let me do?Give you a shield for you?Do you move that pig's mind, is this a balance that people can think of?

In summary, the balance of disgusting people and the almost failed designs caused by balance.

Also, your production capacity is low enough, the original god is 10,000 times higher than your production capacity.

I like this game very much. Astart is really handsome. Titus's story is also worthy of talked about it, but that's it.

In this game, purely borrowed the light of the war hammer, embroidered the pillow rotten grass bag, and could not see it.","首先，如果您是一个观看购买的玩家，那么我的建议是：不要购买，至少在此阶段就是这种情况。
如果您是战锤迷，我建议您在适当的情况下购买，但是如果您根本不是战争锤的粉丝，请重复第一句话。

在这个游戏中，我主要玩江韦（完全解锁）。在此版本的此版本中，它基本上是小丑之一，我只能扮演辅助。我的评估仅基于江韦的游戏经验。

那我为什么不建议购买呢？

在版本的开头，Jian Wei无疑是很多天空，反击无脑炸弹，为队友提供血液恢复和复活服务真的很酷。
如果生产团队不想平衡它，那么我建议您购买它。

首先，玩家的移动性太糟糕了。
老大哥，这是阿斯塔特（Astart），而不是穿着重型盔甲的奥格林（Ogrin），您的跑步速度比游戏中的凡人快。这是合适的吗？隔壁的黑潮超人比您这样称呼的旧e god。不管哪个版本，这是我一直在谈论的问题。许多大型地图，您的运行不快，唯一的用途就是在运行的途中使用它。Hongru，子弹已经满了。

第二点也是最重要的一点。生产团队在精神上智障，尤其是在平衡方面。

哦，有人可能会喷洒，很明显您一开始太简单了，很难来。
他命令教堂，我们希望强大的强者，即三个强大的ast曲，以进行同样的强烈战斗，而不是您将每个人都陷入了老年人，虚弱，恶心和残疾人的困境中。

在平衡方面，有太多的地方可以改变令人恶心的人，这是一个一个一个。

首先，之后可以取消江韦的大多数动作。现在它消失了。当您做成千上万个孩子时，您必须小心地采取行动。他担心人们不能直接干燥您的红色圆圈。

其次，无敌框架的躲避缩短了，攻击的判断被缩短了。您如何更改这个B小工具？我问吗？您认为玩家很舒服吗？对吗？您是否曾经经历过当前游戏？您是否使用Orgarin的智商中的三分之一来考虑这一点，这是超级名模吗？是的，非常超级名模，在哪里超级名模？因为除了反击之外，所有这些都是浪费！您只能在不可阻挡的红色圆圈上闪烁！您肯定可以在一个-ON -ONE上闪烁一盘，只要您掉下无敌的框架，只要您想在您滚动后立即吃掉伤害，然后我也会玩一头牛。

第三，当我谈论这回来时，我很生气。你知道为什么每个人都没有大脑反击吗？这是因为您设计的近战伤害真的是真的！非常低！我剪了3套，最好一次扮演一个高伤害，不是一个好友，是伙伴吗？谁是强迫，恐惧和虐待的黑帮？您是否考虑过球员为什么会形成这些比赛？您可以躺下来睡觉。如果您不小心找到自己的牙齿。

第四，您说一个平衡，表面进行调整。实际上，您的明亮和秘密的改革尚不清楚。前三个问题似乎在您的期望之内，对吗？如果您想重复超级地球，就说。
遥遥无着，我的剑后卫真的害怕遥远，尤其是在战斗时，你不能一直握住盾牌？你不能阻止枪支，对吗？你说你已经降低了子弹的命中率在近战期间，结果是什么？当我接近敌人进行近距离战争时，您的B怪物不愿意近战，只是用脸射击枪支，您的TM橙色前任是”这个距离，你无法逃脱！”迄今为止的命中率降低了。TM脸上的命中率不低。我的TM全血剑剑后卫N5直接被虫子蒸发。DaoLie Fire，您让我做什么？给您盾牌吗？您是否将猪的想法移动，这是人们能想到的平衡吗？

总而言之，令人恶心的人的平衡和几乎由平衡引起的设计失败。

同样，您的生产能力足够低，原始的上帝比您的生产能力高10,000倍。

我非常喜欢这个游戏。阿斯塔特真的很帅。泰特斯的故事也值得谈论它，但仅此而已。

在这个游戏中，纯粹借了战锤的光，绣了枕头烂草袋，看不到它。",-0.9819,"{'Nickname': 'TowardEson', 'Title': '0', 'Play Hours': '41', 'Profile Link': 'https://steamcommunity.com/profiles/76561198364924021/', 'Comment': 'First of all, if you are a player who watched to buy, then my suggestion is: Don\'t buy it, at least this is the case at this stage.\nIf you are a war hammer fan, I will recommend you to buy as appropriate, but if you are not a fans of war hammers at all, then repeat the first sentence.\n\nIn this game, I mainly play Jianwei (completely unlocked). In this version of this version, it is basically one of the clown, and I can only play as auxiliary.My evaluation is only based on the play experience of Jianwei.\n\nSo why don\'t I recommend buying?\n\nIn the beginning of the version, Jian Wei was undoubtedly a lot of sky, fighting back on brainless bombs, and it was really cool to provide teammates with blood recovery and resurrection services.\nIf the production team does not want to balance it, then I will recommend you to buy it.\n\nFirst, the player\'s mobility is too bad.\nBig Brother, this is Astart, not Ogrin, who is wearing heavy armor, you are running faster than the mortal in the game. Is this appropriate?The dark tide superman next door runs faster than your so -called Old E God.No matter which version, this is a problem that I have been talking about. Many big maps, you are not running fast, the only use is to use it on the way to run.Hongru, the bullet is full.\n\nThe second point is also the most important point. The production team is mentally retarded, especially in terms of balance.\n\nSomeone may spray, oh, it is obvious that you are too simple at first, and it is difficult to come.\nHe ordered the church, we want the strong to the strong, that is, three powerful Astarts to play the same strong sea of \u200b\u200bbattles, not you cut everyone into old, weak, sick and disabledCut with bugs.\n\nThere are too many places to change the disgusting people in terms of balance, here is one by one.\n\nFirst, most of the actions of Jianwei can be canceled afterwards. Now it is gone. When you are doing thousands of children, you have to be careful to make a move. He is afraid that people can do not dry you directly for a red circle.\n\nSecond, the dodge of invincible frames shorten and the judgment of the attack is shortened. What do you change this B gadget? I ask?Do you think the player is so comfortable, right?Have you ever experienced the current game?Do you use one -third of your Orgarin\'s IQ to think about it, is this too supermodel?Yes, very supermodel, where is the supermodel?Because except for fighting back, all of them are waste!You can only flash against the unstoppable red circle!You can definitely flash one -on -one, what about the sea?You roll off the invincible frames, as long as you want to eat damage as soon as you roll, then I will also play a cow.\n\nThird, when I talk about this back, I am angry. Do you know why everyone has no brain counterattack?It\'s because the melee damage you designed is really true!Very tm low!I cut 3 sets that it is better to play a high damage once, isn\'t it a buddy, are you gangsters who are gangsters to force and fear and abuse?Have you considered why players have formed these play?You can lay down to sleep at this cut. If you accidentally find you to find your teeth.\n\nFourth, you say a balanced, and the surface is adjusted. In fact, your bright and secret reforms are not known.The first three problems seem to be within your expectations, right?If you want to repeat the super earth, just say.\nTake remote, my sword guard is really afraid of remote, especially when fighting, you can\'t hold the shield all the time?Do you can\'t stop the gun behind, right?You said that you have reduced the hit rate of bullets during melee, and what is the result?When I approached the enemy to play close -up war, your B monsters are unwilling to melee, just to shoot a gun with a face with a face, your TM orange predecessor is ""as long as this distance, you can’t escape it!"" YesThe hit rate is reduced. The hit rate on TM\'s face is not low. My TM full blood sword sword guard N5 was evaporated by a bug directly.Dao Lie Fire, what do you let me do?Give you a shield for you?Do you move that pig\'s mind, is this a balance that people can think of?\n\nIn summary, the balance of disgusting people and the almost failed designs caused by balance.\n\nAlso, your production capacity is low enough, the original god is 10,000 times higher than your production capacity.\n\nI like this game very much. Astart is really handsome. Titus\'s story is also worthy of talked about it, but that\'s it.\n\nIn this game, purely borrowed the light of the war hammer, embroidered the pillow rotten grass bag, and could not see it.', 'Date': '2024/11/5', 'Language': 'zh-cn'}",Success
"This is never what I want. I never thought of playing a bad review. We once wiped out the horrible Terren Zerg, but you betrayed us and betrayed all our combat brothers. You stole the power of the combat brothersAnd to strengthen the Termisan, Star Warrior 2 has only one chance to rise. If you do not seize it, let the angry players complete!Let the tide of bad reviews start!From the Steam store's comment area to the edge of EPIC, let the comment area boil!Let the praise rate fall!Even if every drop of blood from the fighting brothers, we have to see that Star Warrior is strong again!If we can't save it from your failure ... then let the praise rate burn!
Did you play the anti -humans designed by N5?What do you change to others?The emperor will witness your blasphemy!","这从来都不是我想要的。我从没想过要玩不好的评论。我们曾经抹去了可怕的Terren虫子，但您背叛了我们，背叛了我们所有的战斗兄弟。您偷走了战斗兄弟的力量，并加强了终结者的力量，Star Warrior 2只有一个机会就可以上升。如果您不抓住它，让愤怒的玩家完成！让不良评论的潮流开始！从Steam Store的评论区域到Epic的边缘，让评论区域沸腾！即使每一滴战斗兄弟的鲜血，我们必须看到明星战士再次很强！
您是否扮演N5设计的反人类？您会改变其他人吗？皇帝会见证您的亵渎！",-0.9814,"{'Nickname': '李沉舟', 'Title': '0', 'Play Hours': '72.9', 'Profile Link': 'https://steamcommunity.com/profiles/76561198281290473/', 'Comment': ""This is never what I want. I never thought of playing a bad review. We once wiped out the horrible Terren Zerg, but you betrayed us and betrayed all our combat brothers. You stole the power of the combat brothersAnd to strengthen the Termisan, Star Warrior 2 has only one chance to rise. If you do not seize it, let the angry players complete!Let the tide of bad reviews start!From the Steam store's comment area to the edge of EPIC, let the comment area boil!Let the praise rate fall!Even if every drop of blood from the fighting brothers, we have to see that Star Warrior is strong again!If we can't save it from your failure ... then let the praise rate burn!\nDid you play the anti -humans designed by N5?What do you change to others?The emperor will witness your blasphemy!"", 'Date': '2024/10/20', 'Language': 'zh-cn'}",Success
"This is never what I want. I never thought of playing a bad review. We once wiped out the horrible Terren Zerg, but you betrayed us and betrayed all our combat brothers. You stole the power of the combat brothersAnd to strengthen the Termisan, Star Warrior 2 has only one chance to rise. If you do not seize it, let the angry players complete!Let the tide of bad reviews start!From the Steam store's comment area to the edge of EPIC, let the comment area boil!Let the praise rate fall!Even if every drop of blood from the fighting brothers, we have to see that Star Warrior is strong again!If we can't save it from your failure ... then let the praise rate burn!",这从来都不是我想要的。我从没想过要玩不好的评论。我们曾经抹去了可怕的Terren虫子，但您背叛了我们，背叛了我们所有的战斗兄弟。您偷走了战斗兄弟的力量，并加强了终结者的力量，Star Warrior 2只有一个机会就可以上升。如果您不抓住它，让愤怒的玩家完成！让不良评论的潮流开始！从Steam Store的评论区域到Epic的边缘，让评论区域沸腾！即使每一滴战斗兄弟的鲜血，我们必须看到明星战士再次很强！,-0.981,"{'Nickname': '风见幽绫', 'Title': '0', 'Play Hours': '87.6', 'Profile Link': 'https://steamcommunity.com/profiles/76561198410588982/', 'Comment': ""This is never what I want. I never thought of playing a bad review. We once wiped out the horrible Terren Zerg, but you betrayed us and betrayed all our combat brothers. You stole the power of the combat brothersAnd to strengthen the Termisan, Star Warrior 2 has only one chance to rise. If you do not seize it, let the angry players complete!Let the tide of bad reviews start!From the Steam store's comment area to the edge of EPIC, let the comment area boil!Let the praise rate fall!Even if every drop of blood from the fighting brothers, we have to see that Star Warrior is strong again!If we can't save it from your failure ... then let the praise rate burn!"", 'Date': '2024/10/18', 'Language': 'zh-cn'}",Success
"This is never what I want. I never thought of playing a bad review. We once wiped out the horrible Terren Zerg, but you betrayed us and betrayed all our combat brothers. You stole the power of the combat brothersAnd to strengthen the Termisan, Star Warrior 2 has only one chance to rise. If you do not seize it, let the angry players complete!Let the tide of bad reviews start!From the Steam store's comment area to the edge of EPIC, let the comment area boil!Let the praise rate fall!Even if every drop of blood from the fighting brothers, we have to see that Star Warrior is strong again!If we can't save it from your failure ... then let the praise rate burn!
Let The Galaxy Burn!","这从来都不是我想要的。我从没想过要玩不好的评论。我们曾经抹去了可怕的Terren虫子，但您背叛了我们，背叛了我们所有的战斗兄弟。您偷走了战斗兄弟的力量，并加强了终结者的力量，Star Warrior 2只有一个机会就可以上升。如果您不抓住它，让愤怒的玩家完成！让不良评论的潮流开始！从Steam Store的评论区域到Epic的边缘，让评论区域沸腾！即使每一滴战斗兄弟的鲜血，我们必须看到明星战士再次很强！
让银河燃烧！",-0.981,"{'Nickname': 'sekiro', 'Title': '0', 'Play Hours': '11.7', 'Profile Link': 'https://steamcommunity.com/profiles/76561198828064315/', 'Comment': ""This is never what I want. I never thought of playing a bad review. We once wiped out the horrible Terren Zerg, but you betrayed us and betrayed all our combat brothers. You stole the power of the combat brothersAnd to strengthen the Termisan, Star Warrior 2 has only one chance to rise. If you do not seize it, let the angry players complete!Let the tide of bad reviews start!From the Steam store's comment area to the edge of EPIC, let the comment area boil!Let the praise rate fall!Even if every drop of blood from the fighting brothers, we have to see that Star Warrior is strong again!If we can't save it from your failure ... then let the praise rate burn!\nLet The Galaxy Burn!"", 'Date': '2024/10/19', 'Language': 'zh-cn'}",Success
"This is never what I want. I never thought of playing a bad review. We once wiped out the horrible Terren Zerg, but you betrayed us and betrayed all our combat brothers. You stole the power of the combat brothersAnd to strengthen the Termisan, Star Warrior 2 has only one chance to rise. If you do not seize it, let the angry players complete!Let the tide of bad reviews start!From the Steam store's comment area to the edge of EPIC, let the comment area boil!Let the praise rate fall!Even if every drop of blood from the fighting brothers, we have to see that Star Warrior is strong again!If we can't save it from your failure ... then let the praise rate burn!
Let The Galaxy Burn!","这从来都不是我想要的。我从没想过要玩不好的评论。我们曾经抹去了可怕的Terren虫子，但您背叛了我们，背叛了我们所有的战斗兄弟。您偷走了战斗兄弟的力量，并加强了终结者的力量，Star Warrior 2只有一个机会就可以上升。如果您不抓住它，让愤怒的玩家完成！让不良评论的潮流开始！从Steam Store的评论区域到Epic的边缘，让评论区域沸腾！即使每一滴战斗兄弟的鲜血，我们必须看到明星战士再次很强！
让银河燃烧！",-0.981,"{'Nickname': 'DFU_bite', 'Title': '0', 'Play Hours': '39.1', 'Profile Link': 'https://steamcommunity.com/profiles/76561199516883171/', 'Comment': ""This is never what I want. I never thought of playing a bad review. We once wiped out the horrible Terren Zerg, but you betrayed us and betrayed all our combat brothers. You stole the power of the combat brothersAnd to strengthen the Termisan, Star Warrior 2 has only one chance to rise. If you do not seize it, let the angry players complete!Let the tide of bad reviews start!From the Steam store's comment area to the edge of EPIC, let the comment area boil!Let the praise rate fall!Even if every drop of blood from the fighting brothers, we have to see that Star Warrior is strong again!If we can't save it from your failure ... then let the praise rate burn!\nLet The Galaxy Burn!"", 'Date': '2024/10/20', 'Language': 'zh-cn'}",Success
"This is never what I want. I never thought of playing a bad review. We once wiped out the horrible Terren Zerg, but you betrayed us and betrayed all our combat brothers. You stole the power of the combat brothersAnd to strengthen the Termisan, Star Warrior 2 has only one chance to rise. If you do not seize it, let the angry players complete!Let the tide of bad reviews start!From the Steam store's comment area to the edge of EPIC, let the comment area boil!Let the praise rate fall!Even if every drop of blood from the fighting brothers, we have to see that Star Warrior is strong again!If we can't save it from your failure ... then let the praise rate burn!",这从来都不是我想要的。我从没想过要玩不好的评论。我们曾经抹去了可怕的Terren虫子，但您背叛了我们，背叛了我们所有的战斗兄弟。您偷走了战斗兄弟的力量，并加强了终结者的力量，Star Warrior 2只有一个机会就可以上升。如果您不抓住它，让愤怒的玩家完成！让不良评论的潮流开始！从Steam Store的评论区域到Epic的边缘，让评论区域沸腾！即使每一滴战斗兄弟的鲜血，我们必须看到明星战士再次很强！,-0.981,"{'Nickname': '笨笨', 'Title': '0', 'Play Hours': '166.7', 'Profile Link': 'https://steamcommunity.com/profiles/76561198275811289/', 'Comment': ""This is never what I want. I never thought of playing a bad review. We once wiped out the horrible Terren Zerg, but you betrayed us and betrayed all our combat brothers. You stole the power of the combat brothersAnd to strengthen the Termisan, Star Warrior 2 has only one chance to rise. If you do not seize it, let the angry players complete!Let the tide of bad reviews start!From the Steam store's comment area to the edge of EPIC, let the comment area boil!Let the praise rate fall!Even if every drop of blood from the fighting brothers, we have to see that Star Warrior is strong again!If we can't save it from your failure ... then let the praise rate burn!"", 'Date': '2024/10/20', 'Language': 'zh-cn'}",Success
