Comment (English),Comment (Chinese),Compound_Score,Original Data,Translation Status
"This is the best 40k game I'm played.
This is the strongest war hammer 40K game I have ever played

The Player Community is having its own horus here.
Now this game community is staging the Great Rache

ONLY PLAYERS Who Got Skills, RELIC Weapons, Tons of Time, Team, Good Connection to Server,
Only with sufficient technology, the farmers have finished equipment, enough time, teammates who can stabilize teams and players who do not break the network.

Can be ""loyalist"". And any Other Player Who can'T meet all through the requirements of.
Only by the ""loyalty"" as for those players who fail to meet all the above conditions

What will they get? ""You Suck, you deserve that stop crying you heretic.""
What kind of treatment will you get? ""You're rotten, you deserve it, don’t make trouble again.""

Those toxic comments is doing nothing but pushing through poor players to the warmaster.
These ridiculous remarks will only push the poor worm to the ranks of war handsome



""I never winted this."" ""I never watchd to unleash my negative comments""
""I never want to do this"" ""I never want to play my negative review""

""Together We Banished the Enemy of the Imperium.""
We jointly expel the enemy of the empire

""(Community) you betrayed me, (Saber) you betrayed us all.""
(Player community) You betrayed me (developer) You betrayed all of us

""You stole power from me and lies to your customers""
You stole your power and lie to your guests

""This game has only one chance to proper.""
This game has only one chance to develop thriving

""If you will not seize it, then I will.""
If you don't grasp, let me come

""So let it be war.""
Let the war start

""From the Comments of Steam to the Social Media.""
From Steam comment area to major social media

""Let the patch note box."" ""Let the score fall"" ""
Let the update announcement boil and let the score fall

""Thoud it takes the last bit of my passion""
Even if this will dry up my last enthusiasm for the game

""I will set the game freed once more.""
I will let this game be liberated again

""And if I cannot save it from you failure saber, then let the game burn.""
If I can't save the game from Saber's failure, let this game be burned.



I don't care for when patches Will ""the Balance Anymore, Saber.
I no longer care if the update in the future will ""correct"" the balance

The Golden Era of this game is do and gone.
The golden age of this game is over

In 3.0, I feel like I'm taking part in the great crusade.
In version 3.0, I feel that I am participating in the major expedition

I can conquer the galaxy aganides my battle brothers.
I can conquer the galaxy again with the fighting brothers

But after 4.0, Can I Still Trust Those So Called ""Brother""
But after 4.0, I can still believe those so -called ""brothers""

OR the FALSE EMPEROR WHO TAKES Armor Stringth, AMMO CAPACITY, Melee Weapons and Bolters Power Away from Me Anymore?
Or is the pseudo emperor who deprive me of armor, ammunition reserves, melee weapons and intensity of bullets?

May the grim darkness of this game's future there is only war.
May only be disputes in this game's deep and dark future","这是我玩过的最好的40k游戏。
这是我玩过的最强的战锤40k游戏

玩家社区在这里拥有自己的荷鲁斯。
现在这个游戏社区正在登上伟大的Rache

只有获得技能，遗物武器，大量时间，团队，与服务器的良好联系的球员，
只有凭借足够的技术，农民才完成设备，足够的时间，可以稳定不破坏网络的球队和球员的队友。

可以是“忠诚主义者”。以及任何其他无法满足所有要求的球员。
只有“忠诚度”与那些无法满足上述所有条件的玩家一样

他们会得到什么？“你很烂，你应该不要再哭泣的异端。”
您会得到什么样的治疗？“你烂了，你应该得到的，不要再遇到麻烦了。”

那些有毒的评论除了将贫穷的球员推向Warmaster之外，什么也没做。
这些荒谬的言论只会将可怜的蠕虫推向战争的行列



“我从来没有解决这个问题。”“我从不注意释放我的负面评论”
“我永远不想这样做”，“我永远不想玩我的负面评论”

“我们一起驱逐了帝国的敌人。”
我们共同驱逐帝国的敌人

“（社区）你出卖了我，（佩刀）你出卖了我们所有人。”
（玩家社区）您出卖了我（开发人员），您背叛了我们所有人

“你从我身上偷走了力量，向客户撒谎”
你偷了力量，对客人撒谎

“这个游戏只有一个机会可以适当。”
这个游戏只有一个机会发展繁荣

“如果你不抓住它，那我会。”
如果您不掌握，让我来

“所以让它成为战争。”
让战争开始

“从蒸汽的评论到社交媒体。”
从Steam评论领域到主要社交媒体

“让补丁笔记框。”“让得分下降””
让更新公告沸腾，让得分下降

“这需要我的热情的最后一点”
即使这会使我对游戏的最后热情枯竭

“我将再次释放游戏。”
我会让这个游戏再次解放

“而且，如果我无法将其从您的失败军刀中保存，那就让游戏燃烧。”
如果我无法将游戏从Saber的失败中保存下来，请燃烧此游戏。



我不在乎何时会“平衡”，Saber。
我不再关心将来的更新是否会“纠正”余额

这场比赛的黄金时代已经过去了。
这个游戏的黄金时代结束了

在3.0中，我觉得我正在参加伟大的十字军东征。
在3.0版中，我觉得我正在参加大型探险

我可以征服我的战斗兄弟银河系。
我可以与战斗兄弟再次征服银河系

但是在4.0之后，我仍然可以相信那些所谓的“兄弟”
但是在4.0之后，我仍然可以相信那些被称为“兄弟”的人

还是皇帝，他拿着装甲弦，弹药能力，近战武器和螺栓固定力的皇帝不再远离我了吗？
还是伪皇帝剥夺了我的装甲，弹药储备，近战武器和子弹的强度？

愿这个游戏未来的严峻黑暗只有战争。
在这个游戏的深度和黑暗的未来中可能只有争议",-0.9989,"{'Nickname': 'CAST', 'Title': '0', 'Play Hours': '310.1', 'Profile Link': 'https://steamcommunity.com/profiles/76561198251222714/', 'Comment': 'This is the best 40k game I\'m played.\nThis is the strongest war hammer 40K game I have ever played\n\nThe Player Community is having its own horus here.\nNow this game community is staging the Great Rache\n\nONLY PLAYERS Who Got Skills, RELIC Weapons, Tons of Time, Team, Good Connection to Server,\nOnly with sufficient technology, the farmers have finished equipment, enough time, teammates who can stabilize teams and players who do not break the network.\n\nCan be ""loyalist"". And any Other Player Who can\'T meet all through the requirements of.\nOnly by the ""loyalty"" as for those players who fail to meet all the above conditions\n\nWhat will they get? ""You Suck, you deserve that stop crying you heretic.""\nWhat kind of treatment will you get? ""You\'re rotten, you deserve it, don’t make trouble again.""\n\nThose toxic comments is doing nothing but pushing through poor players to the warmaster.\nThese ridiculous remarks will only push the poor worm to the ranks of war handsome\n\n\n\n""I never winted this."" ""I never watchd to unleash my negative comments""\n""I never want to do this"" ""I never want to play my negative review""\n\n""Together We Banished the Enemy of the Imperium.""\nWe jointly expel the enemy of the empire\n\n""(Community) you betrayed me, (Saber) you betrayed us all.""\n(Player community) You betrayed me (developer) You betrayed all of us\n\n""You stole power from me and lies to your customers""\nYou stole your power and lie to your guests\n\n""This game has only one chance to proper.""\nThis game has only one chance to develop thriving\n\n""If you will not seize it, then I will.""\nIf you don\'t grasp, let me come\n\n""So let it be war.""\nLet the war start\n\n""From the Comments of Steam to the Social Media.""\nFrom Steam comment area to major social media\n\n""Let the patch note box."" ""Let the score fall"" ""\nLet the update announcement boil and let the score fall\n\n""Thoud it takes the last bit of my passion""\nEven if this will dry up my last enthusiasm for the game\n\n""I will set the game freed once more.""\nI will let this game be liberated again\n\n""And if I cannot save it from you failure saber, then let the game burn.""\nIf I can\'t save the game from Saber\'s failure, let this game be burned.\n\n\n\nI don\'t care for when patches Will ""the Balance Anymore, Saber.\nI no longer care if the update in the future will ""correct"" the balance\n\nThe Golden Era of this game is do and gone.\nThe golden age of this game is over\n\nIn 3.0, I feel like I\'m taking part in the great crusade.\nIn version 3.0, I feel that I am participating in the major expedition\n\nI can conquer the galaxy aganides my battle brothers.\nI can conquer the galaxy again with the fighting brothers\n\nBut after 4.0, Can I Still Trust Those So Called ""Brother""\nBut after 4.0, I can still believe those so -called ""brothers""\n\nOR the FALSE EMPEROR WHO TAKES Armor Stringth, AMMO CAPACITY, Melee Weapons and Bolters Power Away from Me Anymore?\nOr is the pseudo emperor who deprive me of armor, ammunition reserves, melee weapons and intensity of bullets?\n\nMay the grim darkness of this game\'s future there is only war.\nMay only be disputes in this game\'s deep and dark future', 'Date': '2024/10/21', 'Language': 'en'}",Success
"A You, Saber! Saber Saber I fucking your horse, the whole family still has a panting who can't do this forced and silly dog ​​balance. The mother was launched on the space to find BVVD's mother.The ICU turned to the general ward and went in again. The bed that had passed by the dark tide and the arrow was warm. The fuck, the fucking shotgun was pure Tang, and the dark tide next door was just strengthening the bomb.I can't help but you can't help it. Your mother has a dark tide. My shotgun can hold a road. The explosion made by Saber was hit with a bad jumping egg with a bad jumping egg.The sound blade of the mechanical teaching is the same as the strange shock death
GW should also live the whole family. What kind of stinky dicks are produced by IP games. It is not necessary to put the copyright. It is not easy to control it. The SM2 will be destroyed at a glanceThere are also so many rhinos and Rand without a new suspended vehicle, the veins of the Rhino Randarine's pilot, the size of it will not say it), such as the jet port used on the backpack is understood by the silly Saber as the waste of waste gas.The occupation name must be blind from a few times. The arbiter, the jumping bag assault arbiter, the sword guard, the plunder, and the destroyer are not better than Saber?Is it possible that you want to highlight the professional characteristics and make a tactical tactics similar to dark tide?There is also the most difficult special battle. Four different like it. Are you giving me a G -n -armored chief?Not enough production capacity?What are you doing for a year, are you looking for your own mother?
The sense of blow and refreshing of the one -generation has not been copied, and the advantages have not been copied. The hot melting of the bullet gun is copied.It is fixed to adjust the monomer beam and AOE bullets.Your mother is purely copying. This original casting is different from the original Astert. You can't do anything else.After solving the case, the original cast was just because Saber gave the new organs that it would just be killed
You fucking a stinky, you do n’t look at other people, you do n’t change it in a bad place, you see that you do n’t learn in a good place, especially if you do n’t hold the mentally handicapped talent system.IntersectionOr can't Saber's IQ understand?
I am a shame. I used to play the dark tide and played for 500 hours and pre -purchased the SM2 gold version. Saber is a mentally handicapped.
A You, Saber! KISS My ASS, Go Eat ♥♥♥♥
Saber, I fuck your mother's smell, and your mother cuts it to teach your parents how to play games and wait for the game. These two days have exploded. You should have tortured Saber. What kind of lessons do wwz do?Not absorb
It's like meow, so meow, torture saber
Ah, right, the low -energy translation is the best, there are better translations, not to do it by yourself, oh are embarrassed to think that the bishop biological Titan may not use the translation group.
Saber is really a pure low beast. The production group of Saber. The game balance difference is less and less. We players, don’t scold it.
If you see it, you ca n’t see the player a little better, pure big cheap goods, the bloody backbone setting of the dead mother makes me really want to fuck your mother. There is a needle in the dark tide.You fucking have a broken needle. When you eat, you stare at the condiment and eat the dead insects and pubic hair in the inside. At first, the parents of Saber were in critical condition.
A YOU, Saber! I fuck your mother, the third season of your mother is the complete game. At the beginning, you came out of five months, and then stuffed it back from your mother's rotten force.The uterus, seven months of birth, prematurely, the pure Donary You're really the double patients, live the whole family, The WHOLE FAMILY is Dead","一个你，军刀！军刀军刀我他妈的你的马，整个家庭仍然有一个气喘吁吁的人，无法做到这一点，愚蠢的狗的平衡。这位母亲在空间上发射以找到BVVD的母亲。国际志往前又转向了一般病房。在黑暗的潮汐和箭头经过的床很温暖。他妈的，他妈的shot弹枪是纯净的唐，隔壁的黑潮只是在增强炸弹。我不禁忍不住你。你妈妈有一个黑暗的潮流。我的shot弹枪可以握住一条道路。Saber爆炸的爆炸被一个糟糕的跳跃鸡蛋击中。
GW也应该生活整个家庭。IP游戏产生了什么样的臭味。没有必要放置版权。控制它并不容易。SM2将在Glancethere销毁也是如此多的犀牛和兰特，没有新的吊车，Rhino Randarine的飞行员的脉管，它的大小不会说），例如背包上使用的喷气端口用愚蠢的军刀作为浪费气体。仲裁者，跳袋突击仲裁员，剑后卫，掠夺者和驱逐舰不比军刀好吗？您是否有可能要突出专业特征并制定类似于黑暗潮汐的战术策略？最困难的特殊战斗。四个不同。您是在给我一个g -n武装的酋长吗？生产能力不足？一年来您正在做什么，您正在寻找自己的母亲吗？
尚未复制一个世代的打击和刷新感，并且尚未复制优势。复制子弹枪的热熔化。它是固定的，以调整单体束和AOE子弹。您的母亲纯粹是复制的。这种原始的铸件与原始的Astert不同。您无能为力。解决此案后，原始演员仅仅是因为Saber给了新器官，它将被杀死
你他妈的臭，你不看别人，你不会在一个坏的地方改变它，你会发现你不会在一个好地方学习，尤其是如果你不握住精神障碍的人才系统。印度专家无法理解Saber的智商吗？
我很可惜。我曾经玩过深色潮汐，玩了500小时，并预先购买了SM2金版。军刀是一个精神障碍。
一个你，军刀！亲吻我的屁股，去吃♥♥♥♥
佩刀，我操你母亲的气味，你的母亲将其切下来，以教你的父母如何玩游戏并等待游戏。这两天爆炸了。你应该折磨剑。wwz做什么样的教训？不吸收
就像喵喵，所以喵，酷刑军刀
啊，对，低能的翻译是最好的，有更好的翻译，不要自己做，哦，很尴尬地认为主教生物泰坦可能不会使用翻译小组。
军刀确实是一个纯净的低野兽。Saber的生产组。游戏平衡差异越来越少。我们的球员，不要责骂它。
如果您看到它，那么您就不会看到玩家更好，纯净的廉价商品，死去的母亲的血腥骨干环境使我真的很想他妈的你的母亲。黑暗的潮汐中有一根针。你他妈的有一根针。吃饭时，您会凝视调味品，并在里面吃死昆虫和阴毛。起初，军刀的父母处于危急状态。
一个你，军刀！我他妈的你的母亲，你妈妈的第三季是完整的游戏。一开始，您是五个月中的五个月，然后从母亲的腐烂力中塞回了。家庭死了",-0.9978,"{'Nickname': 'Raiden Mei', 'Title': '0', 'Play Hours': '37.9', 'Profile Link': 'https://steamcommunity.com/profiles/76561199032625327/', 'Comment': ""A You, Saber! Saber Saber I fucking your horse, the whole family still has a panting who can't do this forced and silly dog \u200b\u200bbalance. The mother was launched on the space to find BVVD's mother.The ICU turned to the general ward and went in again. The bed that had passed by the dark tide and the arrow was warm. The fuck, the fucking shotgun was pure Tang, and the dark tide next door was just strengthening the bomb.I can't help but you can't help it. Your mother has a dark tide. My shotgun can hold a road. The explosion made by Saber was hit with a bad jumping egg with a bad jumping egg.The sound blade of the mechanical teaching is the same as the strange shock death\nGW should also live the whole family. What kind of stinky dicks are produced by IP games. It is not necessary to put the copyright. It is not easy to control it. The SM2 will be destroyed at a glanceThere are also so many rhinos and Rand without a new suspended vehicle, the veins of the Rhino Randarine's pilot, the size of it will not say it), such as the jet port used on the backpack is understood by the silly Saber as the waste of waste gas.The occupation name must be blind from a few times. The arbiter, the jumping bag assault arbiter, the sword guard, the plunder, and the destroyer are not better than Saber?Is it possible that you want to highlight the professional characteristics and make a tactical tactics similar to dark tide?There is also the most difficult special battle. Four different like it. Are you giving me a G -n -armored chief?Not enough production capacity?What are you doing for a year, are you looking for your own mother?\nThe sense of blow and refreshing of the one -generation has not been copied, and the advantages have not been copied. The hot melting of the bullet gun is copied.It is fixed to adjust the monomer beam and AOE bullets.Your mother is purely copying. This original casting is different from the original Astert. You can't do anything else.After solving the case, the original cast was just because Saber gave the new organs that it would just be killed\nYou fucking a stinky, you do n’t look at other people, you do n’t change it in a bad place, you see that you do n’t learn in a good place, especially if you do n’t hold the mentally handicapped talent system.IntersectionOr can't Saber's IQ understand?\nI am a shame. I used to play the dark tide and played for 500 hours and pre -purchased the SM2 gold version. Saber is a mentally handicapped.\nA You, Saber! KISS My ASS, Go Eat ♥♥♥♥\nSaber, I fuck your mother's smell, and your mother cuts it to teach your parents how to play games and wait for the game. These two days have exploded. You should have tortured Saber. What kind of lessons do wwz do?Not absorb\nIt's like meow, so meow, torture saber\nAh, right, the low -energy translation is the best, there are better translations, not to do it by yourself, oh are embarrassed to think that the bishop biological Titan may not use the translation group.\nSaber is really a pure low beast. The production group of Saber. The game balance difference is less and less. We players, don’t scold it.\nIf you see it, you ca n’t see the player a little better, pure big cheap goods, the bloody backbone setting of the dead mother makes me really want to fuck your mother. There is a needle in the dark tide.You fucking have a broken needle. When you eat, you stare at the condiment and eat the dead insects and pubic hair in the inside. At first, the parents of Saber were in critical condition.\nA YOU, Saber! I fuck your mother, the third season of your mother is the complete game. At the beginning, you came out of five months, and then stuffed it back from your mother's rotten force.The uterus, seven months of birth, prematurely, the pure Donary You're really the double patients, live the whole family, The WHOLE FAMILY is Dead"", 'Date': '2024/10/18', 'Language': 'zh-cn'}",Success
"The game has become unpleasant since the 4.0 patch
The fatal difficulty is easy to die and the volume is all good. This is the hardest difficulty.
The first problem, the rebirth system, and some classes have disappeared.
Assault is a fatal difficulty that removes the Mayoris, which is threatened with a ground, or removes the body.
If you do it, you can't fill the shield and it's easy to get rid.
The class features are killed and the weapon balance is left.
However, if you do not handle it and shoot a bolt pistol from a distance
And if all the team members die and leave alone, they do not have a shield, whether they are executed alone or fired alone
You must just be hit and die in the infinite offensive.It's nerfed and following the ruined house next door
Since this patch, the way you have been actively has been passive
The fatal difficulty seems to have no merit at all if you get a skin that is unlocked.
When you break the most difficult difficulty, you are just unpleasant and stressed rather than a sense of accomplishment and satisfaction.","自4.0补丁以来，游戏变得令人不愉快
致命的困难很容易死亡，而且体积都很好。这是最困难的困难。
第一个问题，重生系统和一些课程已经消失。
攻击是消除纽约市长的致命困难，该纽约人受到地面的威胁或去除身体。
如果这样做，您将无法填充盾牌，并且很容易摆脱。
班级特征被杀死，武器平衡被杀死。
但是，如果您不处理并从远处射击螺栓手枪
而且，如果所有团队成员都死了，一个人离开，他们没有盾牌，无论他们是独自处决还是独自解雇
您必须在无限的进攻中被击中并死亡。
自从这个补丁以来，您积极的方式一直是被动的
如果您得到已解锁的皮肤，致命的困难似乎根本没有任何优点。
当您打破最困难的困难时，您只是不愉快和压力，而不是成就感和满足感。",-0.9961,"{'Nickname': 'Dark', 'Title': '0', 'Play Hours': '189.8', 'Profile Link': 'https://steamcommunity.com/id/5fdvbg/', 'Comment': ""The game has become unpleasant since the 4.0 patch\nThe fatal difficulty is easy to die and the volume is all good. This is the hardest difficulty.\nThe first problem, the rebirth system, and some classes have disappeared.\nAssault is a fatal difficulty that removes the Mayoris, which is threatened with a ground, or removes the body.\nIf you do it, you can't fill the shield and it's easy to get rid.\nThe class features are killed and the weapon balance is left.\nHowever, if you do not handle it and shoot a bolt pistol from a distance\nAnd if all the team members die and leave alone, they do not have a shield, whether they are executed alone or fired alone\nYou must just be hit and die in the infinite offensive.It's nerfed and following the ruined house next door\nSince this patch, the way you have been actively has been passive\nThe fatal difficulty seems to have no merit at all if you get a skin that is unlocked.\nWhen you break the most difficult difficulty, you are just unpleasant and stressed rather than a sense of accomplishment and satisfaction."", 'Date': '2024/10/18', 'Language': 'ko'}",Success
