Comment (English),Comment (Chinese),Compound_Score,Original Data,Translation Status
"I have 110 hours in the game and it was great until the last patch with all the nerfs. Some heavy hits are almost impossible to dodge (like the chaos marine's flame circle) and at times I get cornered and can't see because my camera's in the wall.

The bots are EXTREMELY BAD. Not only do they not target enemies half the time, but they have no abilities. Just have the bots copy whatever perks you have for that class at least. Enemy bots also focus attacks only on the player if you're unfortunate enough to play alone. Zoanthropes are almost impossible to kill when you have 2 bot teammates and only have a pistol and melee weapon (I was in a public game as Assault and my friend DCed and no one joined).

Instead of pulling a Helldivers move and nerfing the viable/fun weapons, make the other weapons better. The blocking perk feels useless and it takes too long to kill majoris enemies with melee weapons without a parry. As a heavy main I don't ever use the heavy plasma incinerator as it's slow, doesn't do enough damage against majoris+, heats up quick, and takes too long to charge. The other weapons fare much better, but then they nerfed the melta rifle, which I felt never did much damage to extremis+ enemies and requires you to get close while aiming, putting you at a much higher risk.

I don't get how a chaos marine can shoot me point blank as I'm slashing his face.

When choosing a mission, there should be an option to host or join a random squad.

Nerfing the Melta bomb by 70% against bosses defeats the point of it. Hitting that melta is hard and should feel very rewarding.

This game is playing out almost exactly like Helldivers did for me. It was fun, I felt badass, it was rewarding to know patterns, then they hit the game with a bunch of terrible nerfs and made the game more stress than fun and ruined the flow. I haven't played Helldivers much since and I'm starting to feel the same here. What Warhammer should do which Helldivers did right was that instead of making enemies tankier, they threw more at you. This would fit great with this game as it heavily relies on executions and fighting to get armor back.","我在比赛中有110个小时，直到所有Nerfs的最后一个补丁都很棒。一些重击几乎不可能躲闪（例如混乱的海军陆战队的火焰圈），有时我会被拐弯，看不到，因为我的相机在墙上。

机器人非常糟糕。他们不仅不是瞄准敌人的一半时间，而且没有能力。只需将机器人复制您至少在该课程中拥有的任何特权即可。如果您不幸的是一个人打球，敌方机器人也只会将攻击重点放在玩家上。当您有2个机器人队友并且只有手枪和近战武器时，几乎不可能杀死Zoanthropes（我当时是一场公共游戏，当时是袭击，我的朋友DCED，没有人加入）。

与其拉动地狱动物并掩盖可行/有趣的武器，不如使其他武器变得更好。封锁的振作感觉没有用，花了太长时间就用近战武器杀死马里群岛。作为沉重的主体，我从来没有使用过重等离子体焚化器，因为它很慢，对Majoris+造成足够的伤害，很快加热，并且需要太长时间才能充电。其他武器的表现要好得多，但后来他们又掩盖了Melta步枪，我认为这从来没有对Extremis+敌人造成太大伤害，并且要求您在瞄准时靠近，使您面临更高的风险。

当我削减他的脸时，我不知道混乱的海军陆战队如何使我射击。

选择任务时，应该可以选择主持或加入随机小队。

将梅尔塔炸弹击败了70％，对阵老板击败了这一点。击中梅尔塔很难，应该感到非常有意义。

这个游戏的玩法几乎就像我对我所做的那样。这很有趣，我感到很糟糕，知道模式是很有意义的，然后他们用一堆可怕的书呆子打了游戏，使游戏的压力更大，而不是乐趣并破坏了流程。从那以后我再也没有玩过地狱，我开始在这里有同样的感觉。战锤应该做的正确的事是，他们不是让敌人更加坦率，而是向你扔了更多。这将非常适合这款游戏，因为它在很大程度上依赖执行和努力使盔甲恢复原状。",-0.9957,"{'Nickname': 'JaBlue', 'Title': '0', 'Play Hours': '144.2', 'Profile Link': 'https://steamcommunity.com/profiles/76561198195682054/', 'Comment': ""I have 110 hours in the game and it was great until the last patch with all the nerfs. Some heavy hits are almost impossible to dodge (like the chaos marine's flame circle) and at times I get cornered and can't see because my camera's in the wall.\n\nThe bots are EXTREMELY BAD. Not only do they not target enemies half the time, but they have no abilities. Just have the bots copy whatever perks you have for that class at least. Enemy bots also focus attacks only on the player if you're unfortunate enough to play alone. Zoanthropes are almost impossible to kill when you have 2 bot teammates and only have a pistol and melee weapon (I was in a public game as Assault and my friend DCed and no one joined).\n\nInstead of pulling a Helldivers move and nerfing the viable/fun weapons, make the other weapons better. The blocking perk feels useless and it takes too long to kill majoris enemies with melee weapons without a parry. As a heavy main I don't ever use the heavy plasma incinerator as it's slow, doesn't do enough damage against majoris+, heats up quick, and takes too long to charge. The other weapons fare much better, but then they nerfed the melta rifle, which I felt never did much damage to extremis+ enemies and requires you to get close while aiming, putting you at a much higher risk.\n\nI don't get how a chaos marine can shoot me point blank as I'm slashing his face.\n\nWhen choosing a mission, there should be an option to host or join a random squad.\n\nNerfing the Melta bomb by 70% against bosses defeats the point of it. Hitting that melta is hard and should feel very rewarding.\n\nThis game is playing out almost exactly like Helldivers did for me. It was fun, I felt badass, it was rewarding to know patterns, then they hit the game with a bunch of terrible nerfs and made the game more stress than fun and ruined the flow. I haven't played Helldivers much since and I'm starting to feel the same here. What Warhammer should do which Helldivers did right was that instead of making enemies tankier, they threw more at you. This would fit great with this game as it heavily relies on executions and fighting to get armor back."", 'Date': '2024/10/19', 'Language': 'en'}",Success
"Campaign was good, graphics good, story good, operations good, pvp good. But I have one major issue with the game's progression of difficulty. Its feigned, or poorly executed.

TL;DR: Game felt good at first, but as you progress in difficulty, it loses it's shine.. The game's enemies don't increase in number, rather they increase in health as you go up in difficulty, so the enemies are spongier, not harder. This paired with the mechanics of survival on higher difficulty ruined the game for me.

Full explanation:

Instead of throwing more enemies at you, or more variety, they just make the enemies spongier, (give them more health and resistance to stagger.) Same enemy, same moves. Just now it takes 2-3 mags of ammo, instead of 1. Guns feel under powered/useless at higher difficulties.

On the 1st or the 2nd difficulty, you feel like an Astartes, you feel powerful. You charge into combat, your teammates don't need constant supervision. Your weapons feel powerful. Knock it up to 3 difficulty, everything still feels good, weapons are okay, but melee seems more effective.

You hit difficulty 4, all of a sudden your guns feel pretty weak, even gold tier, max perked weapons. Dumping full mags into enemies skulls, and having to reload before they give an execute window. Enemy attacks can nearly wipe your health bar, with one hit. (Speaking about Majoris/Extremis here, the small enemies are never really a huge issue, even on max diffy). Juggling armor charges becomes a chore.

Playing on 5's isn't even playing the same game. No longer do you feel like an Astartes charging into combat, now you're literally just running around scrounging for life stem's and looking for the ever scarce ammo,(which is now even more limited with caps on uses), for a gun that feels useless. All of this while probably roll spamming to wait for your teammates re-spawn timer. This was 9/10 of my 5's, just running for your life, while praying your teammates are doing the same and not dying.

Final Take:

Game was a blast for 40 hours, but if I gotta play like a b!$%# to play on the higher difficulty, that's not fun. Ill still play a 3-4 with friends, but it feels like a chore as I know this game is gonna end up in the uninstalled folder after month or two.","广告系列很好，图形很好，故事很好，运营良好，PVP好。但是我在游戏的难度发展方面有一个主要问题。它的假装或执行不佳。

tl; dr：游戏起初感觉很好，但是随着困难的进展，它会失去光芒。游戏的敌人的数量不会增加，而随着困难的增加，他们的健康状况会增加，所以敌人更海绵，不是更难。这与在更高困难中生存的机制相结合，这对我来说破坏了游戏。

完整的解释：

与其向您扔更多的敌人，或者更多的种类，而只是使敌人变得更加海绵，（使他们对交错更健康和抵抗力。）同样的敌人，同样的举动。刚才需要2-3个弹药，而不是1枪。

在第1或第二个困难中，您会感觉像是一个astartes，您会感到强大。您收取战斗费用，您的队友不需要持续的监督。您的武器感觉强大。将其敲出3个困难，一切仍然感觉不错，武器还可以，但是近战似乎更有效。

您击中了困难4，突然间，您的枪支感觉很虚弱，甚至是金色的最大武器。将完整的磁倒入敌人的头骨中，并必须重新加载，然后才能执行窗口。敌人的攻击几乎可以用一击擦拭您的健康栏。（在这里谈到Majoris/Extremis，即使在Max Diffy上，小敌人也永远不是一个巨大的问题）。杂耍盔甲的费用变成了琐事。

在5上玩甚至都不是玩同一游戏。您不再觉得自己像是在战斗中充电，现在您实际上只是四处奔波，为生命茎而奔波，寻找稀有的弹药（现在更具限制使用的用途上的帽子），因为枪支感觉无用。所有这些都可能在垃圾邮件中等待您的队友重新产生计时器。这是我5的9/10，只是为您的一生而奔跑，同时祈祷队友也在做同样的事情而不是死亡。

最终拍摄：

游戏持续了40个小时，但是如果我必须像B！$％＃玩更高的难度，那并不有趣。生病仍然和朋友一起玩3-4，但感觉就像是一件琐事，因为我知道这款游戏将在一个或两个月后最终放在未安装的文件夹中。",-0.9954,"{'Nickname': 'Seth Brogan', 'Title': '0', 'Play Hours': '42.2', 'Profile Link': 'https://steamcommunity.com/id/sethamphetamemes/', 'Comment': ""Campaign was good, graphics good, story good, operations good, pvp good. But I have one major issue with the game's progression of difficulty. Its feigned, or poorly executed.\n\nTL;DR: Game felt good at first, but as you progress in difficulty, it loses it's shine.. The game's enemies don't increase in number, rather they increase in health as you go up in difficulty, so the enemies are spongier, not harder. This paired with the mechanics of survival on higher difficulty ruined the game for me.\n\nFull explanation:\n\nInstead of throwing more enemies at you, or more variety, they just make the enemies spongier, (give them more health and resistance to stagger.) Same enemy, same moves. Just now it takes 2-3 mags of ammo, instead of 1. Guns feel under powered/useless at higher difficulties.\n\nOn the 1st or the 2nd difficulty, you feel like an Astartes, you feel powerful. You charge into combat, your teammates don't need constant supervision. Your weapons feel powerful. Knock it up to 3 difficulty, everything still feels good, weapons are okay, but melee seems more effective.\n\nYou hit difficulty 4, all of a sudden your guns feel pretty weak, even gold tier, max perked weapons. Dumping full mags into enemies skulls, and having to reload before they give an execute window. Enemy attacks can nearly wipe your health bar, with one hit. (Speaking about Majoris/Extremis here, the small enemies are never really a huge issue, even on max diffy). Juggling armor charges becomes a chore.\n\nPlaying on 5's isn't even playing the same game. No longer do you feel like an Astartes charging into combat, now you're literally just running around scrounging for life stem's and looking for the ever scarce ammo,(which is now even more limited with caps on uses), for a gun that feels useless. All of this while probably roll spamming to wait for your teammates re-spawn timer. This was 9/10 of my 5's, just running for your life, while praying your teammates are doing the same and not dying.\n\nFinal Take:\n\nGame was a blast for 40 hours, but if I gotta play like a b!$%# to play on the higher difficulty, that's not fun. Ill still play a 3-4 with friends, but it feels like a chore as I know this game is gonna end up in the uninstalled folder after month or two."", 'Date': '2024/11/8', 'Language': 'en'}",Success
"Edit 10/28/2024 - Patch 4.0 rolled back some of the..worst changes. However, Chaos is still incredibly unfun to fight for the below reasons. They mention things like win percentages, but I wonder if that's Chaos and Tyranid missions lumped together. The buffs to bolters are..lackluster. They still remain the option for someone wanting to shoot themselves in the foot. I'll mark it recommended but hestitantly.

I won't lie. It was pretty bearable at release but.. I don't really know what the devs are doing in regards to balance and I don't think they know either. Everything I'm about to write is taken from someone who runs 90% difficulty 4 of 5 (Ruthless) and has their survivor helmet from the Lethal (5/5) missions. And this is all for PVE only.

They've done balance passes nerfing the damage on weapons when most of the weapons are already pretty bad.

Chaos majoris are the examplars of this poor design. They can teleport around in an instant. You will need to do about a dozen or two full melee combos to down them but, they can teleport away without warning.

The flamer chaos marines are the worst of the worst. They can teleport without warning in the middle of your combo, charge up a dodge only attack while you're still in an animation that you can't animation cancel out of, and reduce your armor and a good chunk of your HP near instantly. Even if they don't teleport, your dodge roll is shorter than the AOE ring you need to flee from but you won't have time to do the second dodge roll before you're hit. They have incredible range but that doesn't matter because, again, they can teleport to you.

And you may think the answer is a gun. But because the guns have been near nerfed into the ground - you will need to spend multiple magazines per marine.

And they did do a patch that made fighting chaos ... not so bad. And then immediately rolled that back partially and amped up the grind by making us worse at fighting into it.

It's starting to feel that a very vocal minority of players at the upper band of skill levels are dictating the required skill level of all the average skill level players.","编辑10/28/2024-补丁4.0卷回去一些..工作的更改。但是，由于以下原因，混乱仍然令人难以置信。他们提到了胜利百分比之类的东西，但我想知道这是否是混乱和霸王任务。抛光剂的buff是.. lackluster。他们仍然是想要在脚上开枪的人的选择。我会标记推荐，但要hestit。

我不会撒谎。它在发行时很容易忍受。.我真的不知道开发人员在平衡方面正在做什么，而且我认为他们也不知道。我将要写的一切都是从5（残酷）中跑出90％难度4的人，并从致命的（5/5）任务中戴上了幸存者头盔。这仅适用于PVE。

当大多数武器已经很糟糕时，他们已经达到了平衡，从而使武器的损坏降低了。

Majoris混乱是这种不良设计的审查。他们可以瞬间传送。您需要做大约十二或两个完整的近战组合才能使它们降低，但是它们可以在没有警告的情况下传送。

火焰混乱的海军陆战队是最糟糕的。他们可以在组合中间发出警告而不会传送，在您仍无法动画取消动画的动画中，只需向道奇攻击，并立即减少盔甲和大部分HP。即使他们没有传送，您的道奇卷也比您需要逃离的AOE戒指要短，但是您没有时间在击中之前进行第二次道奇卷。它们的范围令人难以置信，但这并不重要，因为他们可以再次传送给您。

您可能会认为答案是枪。但是，由于枪支已经接近地面了 - 您需要每名海军陆战队多张杂志。

他们确实做了一个使混乱的补丁……还不错。然后立即将其部分滚回去，并使我们在战斗中变得更糟，从而加剧了磨削。

开始感觉到，技能水平上部的非常声音的球员在决定所有平均技能水平球员所需的技能水平。",-0.9951,"{'Nickname': 'Mathazzar', 'Title': '1', 'Play Hours': '114.6', 'Profile Link': 'https://steamcommunity.com/profiles/76561197972499254/', 'Comment': ""Edit 10/28/2024 - Patch 4.0 rolled back some of the..worst changes. However, Chaos is still incredibly unfun to fight for the below reasons. They mention things like win percentages, but I wonder if that's Chaos and Tyranid missions lumped together. The buffs to bolters are..lackluster. They still remain the option for someone wanting to shoot themselves in the foot. I'll mark it recommended but hestitantly.\n\nI won't lie. It was pretty bearable at release but.. I don't really know what the devs are doing in regards to balance and I don't think they know either. Everything I'm about to write is taken from someone who runs 90% difficulty 4 of 5 (Ruthless) and has their survivor helmet from the Lethal (5/5) missions. And this is all for PVE only.\n\nThey've done balance passes nerfing the damage on weapons when most of the weapons are already pretty bad.\n\nChaos majoris are the examplars of this poor design. They can teleport around in an instant. You will need to do about a dozen or two full melee combos to down them but, they can teleport away without warning.\n\nThe flamer chaos marines are the worst of the worst. They can teleport without warning in the middle of your combo, charge up a dodge only attack while you're still in an animation that you can't animation cancel out of, and reduce your armor and a good chunk of your HP near instantly. Even if they don't teleport, your dodge roll is shorter than the AOE ring you need to flee from but you won't have time to do the second dodge roll before you're hit. They have incredible range but that doesn't matter because, again, they can teleport to you.\n\nAnd you may think the answer is a gun. But because the guns have been near nerfed into the ground - you will need to spend multiple magazines per marine.\n\nAnd they did do a patch that made fighting chaos ... not so bad. And then immediately rolled that back partially and amped up the grind by making us worse at fighting into it.\n\nIt's starting to feel that a very vocal minority of players at the upper band of skill levels are dictating the required skill level of all the average skill level players."", 'Date': '2024/10/20', 'Language': 'en'}",Success
"Since the patch of 17.10.2024, in ruthless difficulty, number of mobs/ wave/ extremized alert multiplied by 2, time better you will tell me, more xenos to put in piece !!!Yes but no, with the nerve of armor, you become itinerant doors, the switchers of projectiles implodes you in the blink of an eye (even by dodging and playing with the decor).The ""avant-garde"" and ""Assault"" classes have become unplayable.The errors were punitive, now playing is punitive, there is neither fun nor a release.I pass on the reshuffle of ""guard"" type cac weapons, as long as we have the right timing no major change.For the last two levels of difficulty, the composition of the team as well as the armament is no longer a choice.The Devs have just shown how to screw up a game in the air in 1 update (the simple fact of having the armor) to make it a soul like.The Helldivers 2 stampede 2 did not serve as the other studios you have to believe ... the emperor no longer keeps you.",自从17.10.2024的补丁（在无情的困难中您成为巡回门，弹丸的转换器会眨眼间（即使躲避和玩装饰）都崩溃了。“前卫”和“攻击”课程变得无法播放。错误是惩罚性的。是惩罚性的，既没有乐趣也没有发行。而且，由于军备不再是选择。开发人员刚刚展示了如何在1个更新中搞砸一场比赛（拥有装甲的简单事实）使它成为一个灵魂。地狱者2 Stampede 2没有作为您必须相信的其他工作室……皇帝不再让您保持联系。,-0.9882,"{'Nickname': 'Blackøut', 'Title': '0', 'Play Hours': '161.3', 'Profile Link': 'https://steamcommunity.com/profiles/76561198008578069/', 'Comment': 'Since the patch of 17.10.2024, in ruthless difficulty, number of mobs/ wave/ extremized alert multiplied by 2, time better you will tell me, more xenos to put in piece !!!Yes but no, with the nerve of armor, you become itinerant doors, the switchers of projectiles implodes you in the blink of an eye (even by dodging and playing with the decor).The ""avant-garde"" and ""Assault"" classes have become unplayable.The errors were punitive, now playing is punitive, there is neither fun nor a release.I pass on the reshuffle of ""guard"" type cac weapons, as long as we have the right timing no major change.For the last two levels of difficulty, the composition of the team as well as the armament is no longer a choice.The Devs have just shown how to screw up a game in the air in 1 update (the simple fact of having the armor) to make it a soul like.The Helldivers 2 stampede 2 did not serve as the other studios you have to believe ... the emperor no longer keeps you.', 'Date': '2024/10/18', 'Language': 'fr'}",Success
"This is never what I want. I never thought of playing a bad review. We once wiped out the horrible Terren Zerg, but you betrayed us and betrayed all our combat brothers. You stole the power of the combat brothersAnd to strengthen the Termisan, Star Warrior 2 has only one chance to rise. If you do not seize it, let the angry players complete!Let the tide of bad reviews start!From the Steam store's comment area to the edge of EPIC, let the comment area boil!Let the praise rate fall!Even if every drop of blood from the fighting brothers, we have to see that Star Warrior is strong again!If we can't save it from your failure ... then let the praise rate burn!
Let The Galaxy Burn![cube_ anger]","这从来都不是我想要的。我从没想过要玩不好的评论。我们曾经抹去了可怕的Terren虫子，但您背叛了我们，背叛了我们所有的战斗兄弟。您偷走了战斗兄弟的力量，并加强了终结者的力量，Star Warrior 2只有一个机会就可以上升。如果您不抓住它，让愤怒的玩家完成！让不良评论的潮流开始！从Steam Store的评论区域到Epic的边缘，让评论区域沸腾！即使每一滴战斗兄弟的鲜血，我们必须看到明星战士再次很强！
让银河燃烧！[Cube_愤怒]",-0.9868,"{'Nickname': 'Anzahl-M', 'Title': '0', 'Play Hours': '150.3', 'Profile Link': 'https://steamcommunity.com/profiles/76561198325991802/', 'Comment': ""This is never what I want. I never thought of playing a bad review. We once wiped out the horrible Terren Zerg, but you betrayed us and betrayed all our combat brothers. You stole the power of the combat brothersAnd to strengthen the Termisan, Star Warrior 2 has only one chance to rise. If you do not seize it, let the angry players complete!Let the tide of bad reviews start!From the Steam store's comment area to the edge of EPIC, let the comment area boil!Let the praise rate fall!Even if every drop of blood from the fighting brothers, we have to see that Star Warrior is strong again!If we can't save it from your failure ... then let the praise rate burn!\nLet The Galaxy Burn![cube_ anger]"", 'Date': '2024/10/18', 'Language': 'zh-cn'}",Success
